{
  "schema_version": "event-evaluation-v0.1",
  "report_type": "event_level_alignment_evaluation",
  "case_id": "lesson_004",
  "events": [
    {
      "event_id": "lesson-004-seg-001-evt-001",
      "segment_id": "lesson-004-seg-001",
      "target_element_id": "lesson-004-seg-001-el-001",
      "narration_proposition_ids": [
        "lesson-004-nprop-s001-p002",
        "lesson-004-nprop-s001-p003",
        "lesson-004-nprop-s001-p005"
      ],
      "planned_start_sec": 0.0,
      "compiled_start_sec": 0.0,
      "runtime_start_sec": 0.253,
      "rendered_visible_start_sec": null,
      "rendered_visible_end_sec": null,
      "planned_to_compiled_delta_sec": 0.0,
      "compiled_to_runtime_delta_sec": 0.253,
      "target_resolved": true,
      "target_match": true,
      "runtime_status": "executed",
      "render_status": null,
      "semantic_temporal_label": "not_evaluated",
      "onset_error_sec": null,
      "window_overlap_iou": null,
      "outcomes": [
        "render_unobservable"
      ]
    },
    {
      "event_id": "lesson-004-seg-001-evt-002",
      "segment_id": "lesson-004-seg-001",
      "target_element_id": "lesson-004-seg-001-el-002",
      "narration_proposition_ids": [
        "lesson-004-nprop-s001-p001"
      ],
      "planned_start_sec": 1.0,
      "compiled_start_sec": 1.0,
      "runtime_start_sec": 1.069,
      "rendered_visible_start_sec": null,
      "rendered_visible_end_sec": null,
      "planned_to_compiled_delta_sec": 0.0,
      "compiled_to_runtime_delta_sec": 0.069,
      "target_resolved": true,
      "target_match": true,
      "runtime_status": "executed",
      "render_status": null,
      "semantic_temporal_label": "not_evaluated",
      "onset_error_sec": null,
      "window_overlap_iou": null,
      "outcomes": [
        "render_unobservable"
      ]
    },
    {
      "event_id": "lesson-004-seg-002-evt-001",
      "segment_id": "lesson-004-seg-002",
      "target_element_id": "lesson-004-seg-002-el-001",
      "narration_proposition_ids": [
        "lesson-004-nprop-s002-p001",
        "lesson-004-nprop-s002-p003"
      ],
      "planned_start_sec": 0.0,
      "compiled_start_sec": 0.0,
      "runtime_start_sec": 0.065,
      "rendered_visible_start_sec": null,
      "rendered_visible_end_sec": null,
      "planned_to_compiled_delta_sec": 0.0,
      "compiled_to_runtime_delta_sec": 0.065,
      "target_resolved": true,
      "target_match": true,
      "runtime_status": "executed",
      "render_status": null,
      "semantic_temporal_label": "not_evaluated",
      "onset_error_sec": null,
      "window_overlap_iou": null,
      "outcomes": [
        "render_unobservable"
      ]
    },
    {
      "event_id": "lesson-004-seg-002-evt-002",
      "segment_id": "lesson-004-seg-002",
      "target_element_id": "lesson-004-seg-002-el-002",
      "narration_proposition_ids": [
        "lesson-004-nprop-s002-p002"
      ],
      "planned_start_sec": 2.0,
      "compiled_start_sec": 2.0,
      "runtime_start_sec": 2.065,
      "rendered_visible_start_sec": null,
      "rendered_visible_end_sec": null,
      "planned_to_compiled_delta_sec": 0.0,
      "compiled_to_runtime_delta_sec": 0.065,
      "target_resolved": true,
      "target_match": true,
      "runtime_status": "executed",
      "render_status": null,
      "semantic_temporal_label": "not_evaluated",
      "onset_error_sec": null,
      "window_overlap_iou": null,
      "outcomes": [
        "render_unobservable"
      ]
    },
    {
      "event_id": "lesson-004-seg-002-evt-005",
      "segment_id": "lesson-004-seg-002",
      "target_element_id": "lesson-004-seg-002-el-005",
      "narration_proposition_ids": [
        "lesson-004-nprop-s002-p004"
      ],
      "planned_start_sec": 6.0,
      "compiled_start_sec": 6.0,
      "runtime_start_sec": 6.066,
      "rendered_visible_start_sec": null,
      "rendered_visible_end_sec": null,
      "planned_to_compiled_delta_sec": 0.0,
      "compiled_to_runtime_delta_sec": 0.066,
      "target_resolved": true,
      "target_match": true,
      "runtime_status": "executed",
      "render_status": null,
      "semantic_temporal_label": "not_evaluated",
      "onset_error_sec": null,
      "window_overlap_iou": null,
      "outcomes": [
        "render_unobservable"
      ]
    },
    {
      "event_id": "lesson-004-seg-003-evt-001",
      "segment_id": "lesson-004-seg-003",
      "target_element_id": "lesson-004-seg-003-el-001",
      "narration_proposition_ids": [
        "lesson-004-nprop-s003-p002"
      ],
      "planned_start_sec": 0.0,
      "compiled_start_sec": 0.0,
      "runtime_start_sec": 0.066,
      "rendered_visible_start_sec": null,
      "rendered_visible_end_sec": null,
      "planned_to_compiled_delta_sec": 0.0,
      "compiled_to_runtime_delta_sec": 0.066,
      "target_resolved": true,
      "target_match": true,
      "runtime_status": "executed",
      "render_status": null,
      "semantic_temporal_label": "not_evaluated",
      "onset_error_sec": null,
      "window_overlap_iou": null,
      "outcomes": [
        "render_unobservable"
      ]
    },
    {
      "event_id": "lesson-004-seg-003-evt-002",
      "segment_id": "lesson-004-seg-003",
      "target_element_id": "lesson-004-seg-003-el-002",
      "narration_proposition_ids": [
        "lesson-004-nprop-s003-p005"
      ],
      "planned_start_sec": 1.0,
      "compiled_start_sec": 1.0,
      "runtime_start_sec": 1.033,
      "rendered_visible_start_sec": null,
      "rendered_visible_end_sec": null,
      "planned_to_compiled_delta_sec": 0.0,
      "compiled_to_runtime_delta_sec": 0.033,
      "target_resolved": true,
      "target_match": true,
      "runtime_status": "executed",
      "render_status": null,
      "semantic_temporal_label": "not_evaluated",
      "onset_error_sec": null,
      "window_overlap_iou": null,
      "outcomes": [
        "render_unobservable"
      ]
    },
    {
      "event_id": "lesson-004-seg-003-evt-003",
      "segment_id": "lesson-004-seg-003",
      "target_element_id": "lesson-004-seg-003-el-003",
      "narration_proposition_ids": [
        "lesson-004-nprop-s003-p001"
      ],
      "planned_start_sec": 2.0,
      "compiled_start_sec": 2.0,
      "runtime_start_sec": 2.066,
      "rendered_visible_start_sec": null,
      "rendered_visible_end_sec": null,
      "planned_to_compiled_delta_sec": 0.0,
      "compiled_to_runtime_delta_sec": 0.066,
      "target_resolved": true,
      "target_match": true,
      "runtime_status": "executed",
      "render_status": null,
      "semantic_temporal_label": "not_evaluated",
      "onset_error_sec": null,
      "window_overlap_iou": null,
      "outcomes": [
        "render_unobservable"
      ]
    },
    {
      "event_id": "lesson-004-seg-003-evt-004",
      "segment_id": "lesson-004-seg-003",
      "target_element_id": "lesson-004-seg-003-el-004",
      "narration_proposition_ids": [
        "lesson-004-nprop-s003-p003",
        "lesson-004-nprop-s003-p004"
      ],
      "planned_start_sec": 3.0,
      "compiled_start_sec": 3.0,
      "runtime_start_sec": 3.066,
      "rendered_visible_start_sec": null,
      "rendered_visible_end_sec": null,
      "planned_to_compiled_delta_sec": 0.0,
      "compiled_to_runtime_delta_sec": 0.066,
      "target_resolved": true,
      "target_match": true,
      "runtime_status": "executed",
      "render_status": null,
      "semantic_temporal_label": "not_evaluated",
      "onset_error_sec": null,
      "window_overlap_iou": null,
      "outcomes": [
        "render_unobservable"
      ]
    },
    {
      "event_id": "lesson-004-seg-004-evt-001",
      "segment_id": "lesson-004-seg-004",
      "target_element_id": "lesson-004-seg-004-el-001",
      "narration_proposition_ids": [
        "lesson-004-nprop-s004-p001"
      ],
      "planned_start_sec": 0.0,
      "compiled_start_sec": 0.0,
      "runtime_start_sec": 0.066,
      "rendered_visible_start_sec": null,
      "rendered_visible_end_sec": null,
      "planned_to_compiled_delta_sec": 0.0,
      "compiled_to_runtime_delta_sec": 0.066,
      "target_resolved": true,
      "target_match": true,
      "runtime_status": "executed",
      "render_status": null,
      "semantic_temporal_label": "not_evaluated",
      "onset_error_sec": null,
      "window_overlap_iou": null,
      "outcomes": [
        "render_unobservable"
      ]
    },
    {
      "event_id": "lesson-004-seg-004-evt-003",
      "segment_id": "lesson-004-seg-004",
      "target_element_id": "lesson-004-seg-004-el-003",
      "narration_proposition_ids": [
        "lesson-004-nprop-s004-p005"
      ],
      "planned_start_sec": 2.0,
      "compiled_start_sec": 2.0,
      "runtime_start_sec": 2.066,
      "rendered_visible_start_sec": null,
      "rendered_visible_end_sec": null,
      "planned_to_compiled_delta_sec": 0.0,
      "compiled_to_runtime_delta_sec": 0.066,
      "target_resolved": true,
      "target_match": true,
      "runtime_status": "executed",
      "render_status": null,
      "semantic_temporal_label": "not_evaluated",
      "onset_error_sec": null,
      "window_overlap_iou": null,
      "outcomes": [
        "render_unobservable"
      ]
    },
    {
      "event_id": "lesson-004-seg-004-evt-004",
      "segment_id": "lesson-004-seg-004",
      "target_element_id": "lesson-004-seg-004-el-004",
      "narration_proposition_ids": [
        "lesson-004-nprop-s004-p006"
      ],
      "planned_start_sec": 2.2,
      "compiled_start_sec": 2.2,
      "runtime_start_sec": 2.266,
      "rendered_visible_start_sec": null,
      "rendered_visible_end_sec": null,
      "planned_to_compiled_delta_sec": 0.0,
      "compiled_to_runtime_delta_sec": 0.066,
      "target_resolved": true,
      "target_match": true,
      "runtime_status": "executed",
      "render_status": null,
      "semantic_temporal_label": "not_evaluated",
      "onset_error_sec": null,
      "window_overlap_iou": null,
      "outcomes": [
        "render_unobservable"